{
  "$schema": "https://json-schema.org/draft/2020-12/schema",
  "$id": "contracts/technical_route_lease_release_request.v1.json",
  "title": "TechnicalRouteLeaseReleaseRequestV1",
  "type": "object",
  "required": [
    "contract_version",
    "route_id",
    "lease_scope",
    "holder_id",
    "owner_job",
    "lease_token",
    "requested_at_utc",
    "run_id",
    "changed_windows_hash",
    "metadata"
  ],
  "properties": {
    "contract_version": {
      "const": "technical_route_lease_release_request.v1"
    },
    "route_id": {
      "type": "string",
      "minLength": 1
    },
    "lease_scope": {
      "const": "authoritative_store_route"
    },
    "holder_id": {
      "type": "string",
      "minLength": 1
    },
    "owner_job": {
      "type": "string",
      "minLength": 1
    },
    "lease_token": {
      "type": "string",
      "minLength": 1
    },
    "requested_at_utc": {
      "type": "string",
      "minLength": 1
    },
    "run_id": {
      "type": "string"
    },
    "changed_windows_hash": {
      "type": ["string", "null"],
      "pattern": "^[0-9a-f]{64}$"
    },
    "metadata": {
      "type": "object"
    }
  },
  "additionalProperties": false
}
